statement_no,debate,night,speaker,speaker_type,timestamp,statement
91,9,1,,other,24:26,"And that means families are going to pick up the rest of the costs. Amy, I looked online at your plan. It’s two paragraphs. Families are suffering and they need a plan."
92,9,1,Klobuchar,candidate,24:39,"Okay, that’s it."
93,9,1,,other,24:39,"You can’t simply stand here and trash an idea to give healthcare coverage to everyone without having a realistic plan of your own. And if you’re not going to own up to the fact either that you don’t have a plan or that your plan is going to leave people without healthcare coverage, full coverage, then you need to say so. I just want to stay on this [crosstalk 00:25:01] was in Reno when I met a man who said he had diabetes. He gets his insulin through the VA, but his sister and his daughter also have diabetes. No way to pay for their insulin. Three human beings right here in Nevada who are struggling. They share one insulin prescription. This should not happen [crosstalk 00:25:24]"
94,9,1,Todd,proctor,25:23,"Okay. Very quickly. Mayor Bloomberg, is Vice President Biden right and you weren’t a fan of Obamacare?"
95,9,1,,other,25:28,I am a fan of Obamacare. At the beginning –
96,9,1,Biden,candidate,25:30,Since when Mr. Mayor?
97,9,1,,other,25:32,"Mr Vice President, I just checked the record because you’d said one time that I was not. In ’09 I testified and gave a speech before the mayor’s conference in Washington advocating it and trying to get all the mayors to sign on. And I think at that time I wrote an article praising Obamacare. It was either in the New York Post or the Daily News, so the facts are, I was [crosstalk 00:25:56]"
98,9,1,Biden,candidate,25:56,Didn’t you call it [crosstalk 00:25:56]
99,9,1,,other,25:56,"Let me finish. Thank you. I was in favor of it. I thought it didn’t do … go as far as we should. What Trump has done to this is a disgrace. The first thing we’ve got to do is get the White House and bring back those things that will left and then find a ways to expand it. Another public option to having some rules about capping charges. All of those things. We shouldn’t just walk away and start something that is totally new, untried. People [crosstalk 00:26:27]"
100,9,1,Todd,proctor,26:27,"Okay. Vice President Biden, go ahead."
101,9,1,Biden,candidate,26:29,"The mayor said when we passed it, the signature piece of this administration, it’s a disgrace. They’re the exact words. It was a disgrace. Look it up. Check it out. It was a disgrace. [crosstalk 00:26:42] covered by the way, that plan you do not have surprise billing. You bring down drug prices. People are not … Give people all the things we’re just talking about. I guess you’re not got all the time to do it, but if I get a chance to talk [crosstalk 00:26:55]"
102,9,1,Todd,proctor,26:54,"Thank you, sir. Lester."
103,9,1,Holt,proctor,26:55,"All right, Mayor Bloomberg [crosstalk 00:26:59]"
104,9,1,Female,other,26:59,We haven’t responded to [crosstalk 00:26:59] allegation.
105,9,1,Holt,proctor,26:59,"… at the beginning of this debate, you took some incoming fire on this next topic, so let’s get into it. In 2015 this is how you described your policing policy as mayor quote, “We put all the cops in the minority neighborhoods.” And you explain that is quote, “Because that’s where all the crime is.”"
106,9,1,Holt,proctor,27:15,"You went on to say, “And the way you should get the guns out of the kids’ hands is to throw them against the wall and frisk them.” You’ve apologized for that policy, but what does that kind of language say about how you view people of color or people in minority neighborhoods?"
107,9,1,,other,27:29,"Well, if I go back and look at my time in office, the one thing that I’m really worried about, embarrassed about, was how it turned out with Stop and Frisk. When I got into office, there was 650 murders a year in New York City. I thought that my first responsibility was to give people the right to live. That’s the basic right of everything. And we started, we adopted a policy which had been in place. The policy that all big police departments use of stop and frisk."
108,9,1,,other,28:05,"What happened, however was it got out of control. And when we discovered, I discovered, that we were doing many, many, too many stop and frisks, we cut 95% of it out. I’ve sat down with a bunch of African-American clergy and business people to talk about this, to try to learn. I’ve talked to a number of kids who’d been stopped. I was trying to understand how we change our policies so we can keep the city safe because the crime rate did go from 650, 50% down, to 300. And we have to keep lid on crime, but we cannot go out and stop people indiscriminately. That was what was happening."
109,9,1,Holt,proctor,28:49,"Mayor, thank you. Let me go to Vice President Biden with this. You want to respond to that? Put an end to it?"
110,9,1,Biden,candidate,28:53,"Yes. Let’s get something straight. The reason the stop and frisk change is because Barack Obama sent moderators to see what was going on. When we sent them there to say, “This practice has to stop,” the mayor thought it was a terrible idea. We send them there, a terrible idea. Let’s get the facts straight. Let’s get the order straight. And it’s not whether he apologize or not, it’s the policy. The policy was abhorrent and it was, in fact, of violation of every right people have. We are the one, our administration sent in people to monitor it. And the very time the mayor argued against that. This idea that he figured out it was a bad idea. He figured out it was a bad idea after we sent in monitors and said it must stop. Even then he continued the policy."
111,9,1,Holt,proctor,29:44,"All right. Mayor, would you like to make a quick response to that?"
112,9,1,,other,29:45,"Yes, I would. I’ve sat. I’ve apologized. I’ve asked for forgiveness, but the bottom line is that we stopped too many people. We stopped too many people and we’ve got to make sure that we do something about criminal justice in this country. There is no great answer to a lot of these problems. If we took off everybody that was wrong off this panel, everybody that was wrong on criminal justice at some time in their careers, there’d be nobody else up here."
113,9,1,Holt,proctor,30:15,Senator Warren.
114,9,1,Sanders,candidate,30:16,Let’s be clear. I’m sorry. Who did you call on?
115,9,1,Holt,proctor,30:18,Senator Warren.
116,9,1,,other,30:20,"I do think that this really is about leadership and accountability. When the mayor says that he apologized, listen very closely to the apology. The language he used is about stop and frisk. It’s about how it turned out. Now this isn’t about how it turned out. This is about what it was designed to do to begin with. It targeted communities of color, it targeted black and brown men from the beginning. And if you want to issue a real apology, then the apology has to start with the intent of the plan as it was put together and the willful ignorance day by day by day of admitting what was happening. Even as people protested in your own street, shutting out the sounds of people telling you how your own policy was breaking their lives. You need a different apology."
117,9,1,Holt,proctor,31:15,"Senator, thank you. Chuck?"
118,9,1,Sanders,candidate,31:16,Can I respond here?
119,9,1,Todd,proctor,31:19,"Senator Klobuchar, we’re going to stay on this topic, but I want to get something in here with Senator Klobuchar. When you were the top prosecutor in Minneapolis, Senator, there were at least two dozen instances where police were involved in the deaths of civilians. None of those officers were prosecuted. You did prosecute a black teenager who was sentenced to life in prison despite what are now serious doubts about the evidence. Now, the Minneapolis chapter of the NAACP has recently called for you to suspend your campaign over that case because some new evidence has come out since. Big picture. Why should black and Latino voters trust your judgment now if it appears you may have gotten it wrong then?"
120,9,1,Klobuchar,candidate,31:57,"First, I’ll start with that case. It is very clear that any evidence, if there is new evidence, even old evidence, it should be reviewed by that office and by the County attorney. That must happen. I have called for that review. This was a case involving an 11-year-old African-American girl named Tyesha Edwards who was shot doing her homework at her kitchen table. Three people were convicted. One of the cases is the one that is being investigated … was investigated by a journalist. And I think it’s very important that that evidence come forward."
121,9,1,Klobuchar,candidate,32:35,"In terms of the police shootings that you noted, those went to a grand jury, every single one of them. And I made very clear, for months now, that like so many prosecutors, I think those cases, in my time, they were all going to the grand jury. It was thought that was the best way to handle them in many, many jurisdictions."
122,9,1,Moderator,other,32:57,Do you think you should’ve spoke up? You didn’t speak up at the time. Should you?
123,9,1,Klobuchar,candidate,32:57,I actually did speak up on something very similar and that was when our police chief in Minneapolis tried to take the investigations of police shootings into his own hands. I strongly said I disagreed with that. Now I do believe also that a prosecutor should make those decisions herself.
124,9,1,Klobuchar,candidate,33:14,"And the last thing I will say, because you asked the question about voting, I have the support of African-Americans in my community in every election. I had strong support and strong support of leadership. And that’s because I earned it. And this is going to be on me to earn it. You earn it with what you stand for when it comes to equal opportunity. You earn it with the work that I have done, the leadership I’ve shown on voting rights. And yes, you earn it with the work that must be done on criminal justice reform."
125,9,1,Moderator,other,33:42,"Thank you, Senator. Hallie Jackson."
126,9,1,,other,33:43,"I wan to talk about transparency here. [inaudible 00:33:45] many Democrats, including most of you on stage, have criticized president Trump for his lack of transparency. But Senator Sanders, when you are here in Las Vegas in October, you are hospitalized with a heart attack. Afterwards, you pledged to make a quote, “All your medical records public.” You’ve released three letters from your doctors, but you now say you won’t release anything more. What happened to your promise of full transparency?"
127,9,1,Sanders,candidate,34:07,"I think we did. Let me tell you what happened. First of all, you’re right and thank you Las Vegas for the excellent medical care I got in the hospital two days. And I think the one area, maybe that Mayor Bloomberg and I share, you have stents as well."
128,9,1,,other,34:23,25 years ago.
129,9,1,Sanders,candidate,34:25,"Well, we both have two stents. It’s a procedure that is done about a million times a year. So we released the full report of that heart attack. Second of all, we released the full, my whole 29 years in the Capitol, the attending physician, all of my history, medical history. And furthermore, we released reports from two leading Vermont cardiologist who described my situation. And by the way, who said, “Bernie Sanders is more than able to deal with the stress and the vigor of being president of the United States.” Hey, follow me around the campaign trail. Three, four, five events a day. See how you’re doing compared to me."
130,9,1,,other,35:08,"Mayor Buttigieg, you’ve been critical about transparency on this stage and people needing to do better. Is that response from Senator Sanders enough for you?"
131,9,1,Buttigieg,candidate,35:15,"No, it’s not because, first of all, let me say we are all delighted that you are in fighting shape."
132,9,1,Sanders,candidate,35:19,Thank you.
133,9,1,Buttigieg,candidate,35:20,"And at the same time, transparency matters, especially living through the Trump era. Now under president Obama, the standard was that the president would release full medical records. Do a physical and release the readout. I think that’s the standard that we should hold ourselves to as well. Now, President Trump lowered that standard. He said just a letter from a doctor is enough, and a lot of folks on this stage are now saying that’s enough. But I am certainly prepared to get a physical, put out the results. I think everybody here should be willing to do the same. But I’m actually less concerned about the lack of transparency on Sander’s personal health than I am about the lack of transparency on how to pay for his healthcare plan."
134,9,1,Buttigieg,candidate,36:02,"Since he said that it’s impossible to even know how much it’s going to cost. And even after raising taxes on everybody making $29,000, there is still a multi-trillion dollar hole. Matter of fact, if you add up his policies altogether, they come to $50 trillion. He’s only explained $25 trillion worth of revenue, which means that the hole in there is bigger than the size of the entire economy of the United States."
135,9,1,,other,36:27,Mayor Buttigieg-
136,9,1,Buttigieg,candidate,36:27,The time has come to level with the American people on matters personal and on matters of policy.
137,9,1,,other,36:32,"Thank you. Senator Sanders, quickly."
138,9,1,Sanders,candidate,36:34,"Let’s level. Let’s level, Pete. Under your plan, which is a maintenance continuation of the status quo-"
139,9,1,Buttigieg,candidate,36:41,That’s-
140,9,1,Sanders,candidate,36:42,"Can I finish? The average American today is paying $12,000 a year. That’s what that family is paying. 20% of a 60,000 income, $12,000 a year. Highest prices in the world for prescription drugs. Just the other day, a major study came out from Yale, epidemiologists in Lancet, one of the leading medical publications in the world. What they said, my friends, is Medicare for all will save $450 billion a year because we are eliminated the absurdity of thousands of separate plans that required hundreds of billions of dollars of administration. And by the way, ending the hundred billion a year in profiteering for the drug companies and the insurance companies."
141,9,1,Buttigieg,candidate,37:27,This is really important. [crosstalk 00:37:29]
142,9,1,,other,37:28,"Senator Sanders, thank you. Mayor Bloomberg, I want to go to you on this."
143,9,1,Sanders,candidate,37:30,"Your plan, by the way [crosstalk 00:37:31] costs."
144,9,1,Buttigieg,candidate,37:32,"That’s false. Look, if my plan is to status quo, why was it attacked by the insurance industry the moment it came out? And on issue after issue after issue, this is what Senator Sanders is saying. If you’re not with him, if you’re not all the way on his side, then you must be for the status quo. Well you know what? That is a picture that leaves most of the American people out."
145,9,1,,other,37:52,"I want to go to Mayor Bloomberg on this, the transparency issue."
146,9,1,,other,37:55,"Very briefly on transparency, Mayor Bloomberg, your campaign has said that you would eventually release your tax records-"
147,9,1,,other,38:01,Yes.
148,9,1,,other,38:01,"… when it comes to transparency, but people are already voting now. Why should democratic voters have to wait?"
149,9,1,,other,38:07,It just takes us a long time. Unfortunately or fortunately-
150,9,1,Klobuchar,candidate,38:10,Can I comment on that?
151,9,1,,other,38:11,"Fortunately, I make a lot of money and we do business all around the world and we are preparing it. The number of pages will probably be in the thousands of pages. I can’t go to Turbo Tax, but I put out my tax return every year for 12 years in city hall. We will put out this one. It says, tells everybody everything they need to know about every investments that I make and where the money goes. And the biggest item is all the money I give away, and we list that. Every single donation I make, and you can get that from our foundation anytime you want."
152,9,1,Klobuchar,candidate,38:47,"I’m just looking at my husband in the front row that has to like do our taxes all the time. We probably could go to Turbo Tax. And the point of this is I believe in transparency. I had a physical, by the way. It came out well. We might all be surprised if my blood pressure is lower than Mayor Pete’s. That might really shock everyone out there. And I think you should release your records from your physical."
153,9,1,Klobuchar,candidate,39:10,"Secondly, when it comes to tax returns, everyone up here has released their tax returns, Mayor. And it is a major issue because the president of the United States has been hiding behind his tax returns, even when courts order him to come forward with those tax returns. I don’t care how much money anyone has. I think it’s great you got a lot of money, but I think you’ve got to come forward with your tax returns."
154,9,1,,other,39:35,"Senator Warren, I’m going to get to you in a second. Mayor Bloomberg, quick response to Senator Klobuchar."
155,9,1,,other,39:38,"We’re releasing them. They’ll be out in a few weeks, and that’s just as fast as I can do it. Remember, I only entered into this race 10 weeks ago. All of my associates here have been at this for a couple of years."
156,9,1,Buttigieg,candidate,39:51,"That’s right, we have."
157,9,1,,other,39:51,And we did not [crosstalk 00:39:52]
158,9,1,Buttigieg,candidate,39:51,Engaging with voters and humbling ourselves in backyards [crosstalk 00:39:53]
159,9,1,,other,39:52,"Let me ask you about something else, Mr. Mayor because-"
160,9,1,,other,39:53,10 weeks ago [crosstalk 00:39:53] over time and get it done.
161,9,1,,other,40:02,"Mayor Bloomberg, let me ask you about something else. Senator Warren."
162,9,1,,other,40:03,Wish it were that simple.
163,9,1,,other,40:03,I’ll let you get in here. But Mayor Bloomberg-
164,9,1,,other,40:03,It would save me a lot of money.
165,9,1,,other,40:04,"Let me ask you about something else. Several former employees have claimed that your company was a hostile workplace for women. When you were confronted about it, you admitted making sexually suggestive remarks saying quote, “That’s the way I grew up.” In a lawsuit in the 1990s, according to the Washington Post, one former female employee alleged that you said quote, “I would do you in a second.” Should Democrats expect better from their nominee?"
166,9,1,,other,40:28,"Let me say a couple things and if I can have my full minute and a quarter. Thank you. I have no tolerance for the kind of behavior that the Me Too Movement has exposed. And anybody that does anything wrong in our company, we investigate it. And if it’s appropriate, they’re gone that day. But let me tell you what I do in my company and my foundation and in city government when I was there. In my foundation, the person that runs, it’s a woman. 70% of the people there are women. In my company, lots and lots of women have big responsibilities. They get paid exactly the same as men. And in city hall, the person that’s the top person, my deputy mayor was a woman and 40% of our commissioners were women."
167,9,1,,other,41:20,"I am very proud of the fact that about two weeks ago we were awarded, we were voted the most … the best place to work, second best place in America. If that doesn’t say something about our employees and how happy they are, I don’t know what does."
168,9,1,,other,41:39,"Senator Warren, you’ve been critical of Mayor Bloomberg on this issue."
169,9,1,,other,41:42,"Yes, I have. I hope you’ve heard what his defense was, “I’ve been nice to some women.” That just doesn’t cut it. The mayor has to stand on his record. And what we need to know is exactly what’s lurking out there. He has gotten some number of women … dozens? Who knows … to sign nondisclosure agreements both for sexual harassment and for gender discrimination in the workplace. So Mr. Mayor, are you willing to release all of those women from those nondisclosure agreements so we can hear their side of the story?"
170,9,1,,other,42:26,We have a very few nondisclosure agreements.
171,9,1,,other,42:30,How many is that?
172,9,1,,other,42:31,Let me finish.
173,9,1,,other,42:31,How many is that?
174,9,1,,other,42:33,None of them accused me of doing anything other than maybe they didn’t like a joke I told. These would be agreements between two parties that wanted to keep it quiet and that’s up to them. They signed those agreements and we’ll live with it.
175,9,1,Biden,candidate,42:49,Come on.
176,9,1,,other,42:49,"So wait. When you say a … I just want to be clear. Some is how many? And when you say they signed them and they wanted them, if they wish now to speak out and tell their side of the story about what it is they alleged, that’s now okay with you? You’re releasing them on television tonight?"
177,9,1,,other,43:11,"Senator, no."
178,9,1,,other,43:11,Is that right?
179,9,1,,other,43:11,"Senator, the company and somebody else, in this … the man or a woman or could be more than that, they decided when they made an agreement that they wanted to keep it quiet for everybody’s interests."
180,9,1,,other,43:27,No.
181,9,1,Biden,candidate,43:27,Come on.
182,9,1,,other,43:27,They sign the agreements and that’s what we’re going to live.
183,9,1,Buttigieg,candidate,43:29,They could release them now.
184,9,1,,other,43:30,"I’m sorry. No, the question is, are the women-"
185,9,1,,other,43:32,I heard your question.
186,9,1,,other,43:33,"… bound by being muzzled by you? And you could release them from that immediately. Because understand, this is not just a question of the mayor’s character. This is also a question about electability. We are not going to be Donald Trump with a man who has who knows how many nondisclosure agreements and the drip, drip, drip of stories of women saying they have been harassed and discriminated against. That’s not what we do as Democrats."
187,9,1,,other,44:03,… and discriminated against. That’s not what we do as Democrats.
188,9,1,,other,44:03,Mr. Vice President.
189,9,1,Biden,candidate,44:06,"Look, let’s get something straight here. It’s easy, all the mayor has to do is say you are released from the non-disclosed agreement, period. We talk about transparency here. This guy got himself in trouble and he couldn’t disclose what he did, he went to his company."
190,9,1,Buttigieg,candidate,44:24,"To be super clear that was about the list of clients, so nobody gets the wrong idea."
191,9,1,Biden,candidate,44:27,"No, no, I’m sorry."
192,9,1,Buttigieg,candidate,44:29,"I know what you mean, no, you’re right."
193,9,1,Biden,candidate,44:31,"He went to the company and said, “I want to be released. I want to be able to do it.” Look, this is about transparency. From the very beginning, whether it’s your health record, whether it’s your taxes, whether you have cases against you, whether or not people have signed nondisclosure agreements. You think that women in fact were ready to say, “I don’t want anybody to know about what you did to me.” That’s not how it works. The way it works is they say, “Look, this is what you did to me.” And the mayor comes along and his attorney said, “I will give you this amount of money if you promise you’ll never say anything.” That’s how it works."
194,9,1,,other,45:04,"Mayor Bloomberg, final word to you."
195,9,1,,other,45:07,"I’ve said, we’re not going to end these agreements because they were made consensually and they have every right to expect that they will stay private."
196,9,1,Biden,candidate,45:18,"If they want to release it, they should be able to release themselves. Say yes."
197,9,1,Sanders,candidate,45:24,"You know, we talk about electability and everybody up here wants to beat Trump. And we talked about stop and frisk and [inaudible 00:45:32] has established and the problems there, but maybe we should also ask how Mayor Bloomberg in 2004 supported George W. Bush for president. Put money into Republican candidates for the United States Senate, when some of us, Joe and I and others were fighting for Democrats to control the United States Senate."
198,9,1,Biden,candidate,45:50,[inaudible 00:45:51].
199,9,1,Sanders,candidate,45:52,"Maybe we can talk about a billionaire saying that we should not raise the minimum wage or that we should cut social security, Medicare and Medicaid. If that’s a way to beat Donald Trump, wow, I would be very surprised."
200,9,1,,other,46:06,"Thank you, Senator. Vanessa to you."
201,9,1,,other,46:08,"Wait, wait."
202,9,1,,other,46:09,"Senator Klobuchar, you’re running om your Washington experience. But last week in a Telemundo interview, you could not name the President of Mexico or discuss any of his policies. Last night you defended yourself saying, “This isn’t Jeopardy.” But my question to you is, shouldn’t our next president know more about one of our largest trading partners?"
203,9,1,Klobuchar,candidate,46:35,"Of course. Of course. And I don’t think that that momentary forgetfulness actually reflects what I know about Mexico and how much I care about it. And I first want to say greetings to President Lopez Obrador. Secondly, what I meant the game of Jeopardy is that I think we could all come up with things. You know how many members are there in the Israeli Knesset? 120. Who is the president of Honduras?"
204,9,1,,other,47:12,Senator Klobuchar.
205,9,1,Klobuchar,candidate,47:12,Hernandez.
206,9,1,,other,47:13,Senator Klobuchar.
