statement_no,debate,night,speaker,speaker_type,timestamp,statement
284,9,1,,other,06:10,I’m the only one here that’s started a business.
285,9,1,Todd,proctor,06:13,"Mayor Bloomberg, you seem to imply that red lining and stopping red lining has somehow contributed to the financial crisis."
286,9,1,,other,06:22,No. That’s exactly wrong.
287,9,1,Todd,proctor,06:23,And that was the implication that came out in the quote. So I want to give you a chance to clarify this.
288,9,1,,other,06:27,"Well on the record against red lining, since I worked on Wall Street. I was against it during the financial crisis. I’ve been against it since the financial crisis came about because the people that took the mortgages packaged them and other people bought them. That was where all the disaster was. Red lining is still a practice some places and we’ve got to cut it out, but it’s just not true."
289,9,1,,other,06:53,"What I was going to say, maybe you want to talk about businesses. I’m the only one here I think that’s ever started a business. Is that fair? Okay. What do we need is, I can tell you in New York City we had programs. There are mentoring programs for the young business people so they can learn how to start a business. We had programs that could get them seed capital. We have programs to get branch banking in their neighborhoods, because if you don’t have a branch bank there, you can’t get a checking account, can’t get a checking account, you can’t get a loan. You can’t get a loan, you can’t get a mortgage. Then you don’t have any wealth. There’s ways to fix this and it doesn’t take trillions of dollars. It takes us to focus on the problems of small business."
290,9,1,Todd,proctor,07:31,"Senator Sanders, 45 seconds, then we’re going to move on. Senator Sanders, 45 seconds."
291,9,1,Sanders,candidate,07:36,"All right. When we talk about a corrupt political system bought by billionaires like Mr. Bloomberg, it manifests itself in a tax code in which not only is Amazon and many other major corporations, some owned by the wealthiest people in this country, not paying a nickel in taxes, we have the insane situation that billionaires today, if you can believe it, have an effective tax rate lower than the middle-class. So maybe just-"
292,9,1,,other,08:08,"Senator, you’re writing the tax code. Why are you complaining? Who wrote the code?"
293,9,1,Sanders,candidate,08:13,"You did, you and your campaign contributions."
294,9,1,,other,08:18,You and the other 99 Senators.
295,9,1,Sanders,candidate,08:18,Not me. You and your campaign contributions are electing people to represent the wealthy and the powerful.
296,9,1,,other,08:24,"Yes, those are the Democrats, thank you."
297,9,1,Sanders,candidate,08:26,"Well, and Republicans too, and George W. Bush as well."
298,9,1,Todd,proctor,08:30,"Senator Klobuchar, let me address-"
299,9,1,Klobuchar,candidate,08:33,"I was just, I was thinking there was going to be a rematch on Saturday in Vegas and those guys should go down there."
300,9,1,Todd,proctor,08:38,"Senator Klobuchar, I actually want to get you to something about Senator Sanders tweeted last year, “Billionaires should not exist.” What say you?"
301,9,1,Klobuchar,candidate,08:50,"Okay. I believe in capitalism. But I think the goal of someone in government and a President of the United States should be a check on that. I’m not going to limit what people make, but I think right now our tax code is so tilted against regular people and that is what’s wrong. I was thinking of your question about small businesses. The small businesses I talked to, they have trouble getting employees because their employees don’t have childcare. We should have universal childcare. And we have not been talking enough about Donald Trump and let’s just talk about Donald Trump because he signed that tax bill that helped the wealthy. And he went down Mar-a-Lago and he said to all his friends, “You just got a lot richer.” That is Exhibit A. And I can tell you the hardworking people in Nevada, were not in that room. So the key to me is to not limit what people can make, but make sure that we have a government that is fair for everyone."
302,9,1,Todd,proctor,09:47,"So Senator Sanders, what did you mean that you don’t think they should exist. What did that mean?"
303,9,1,Sanders,candidate,09:50,"I’ll tell you what I mean. We have a grotesque and immoral distribution of wealth income. Mike Bloomberg owns more wealth than the bottom 125 million Americans. That’s wrong. That’s immoral. That should not be the case when we got a half a million people sleeping out on the streets, where we have kids who cannot afford to go to college, when we have 45 million people dealing with student debt. We have enormous problems facing this country and we cannot continue seeing a situation where in the last three years, billionaires in this country saw an $850 billion increase in their wealth. Congratulations, Mr. Bloomberg. But the average American last year saw less than a 1% increase in his or her income. That’s wrong."
304,9,1,Todd,proctor,10:43,"Mayor Bloomberg, should you exist?"
305,9,1,,other,10:45,"I can’t speak for all billionaires. All I know is I’ve been very lucky, made a lot of money and I’m giving it all away to make this country better. And a good chunk of it goes to the Democratic Party as well."
306,9,1,Todd,proctor,10:55,Is it too much? Have you earned too much money? Has it been an obscene amount of … should you have earned that much money?
307,9,1,,other,11:03,Yes. I worked very hard for it. And I’m giving it away.
308,9,1,Todd,proctor,11:08,Thank you. Helen.
309,9,1,,other,11:11,"Mayor, Senator Sanders has a proposal that will require all large companies to turn over up to 20% of their ownership to employees over time. Is that a good idea?"
310,9,1,Buttigieg,candidate,11:20,"I think that employee ownership of companies is a great idea. I’m not sure it makes sense to command those companies to do it. If we really want to deliver less inequality in this country, then we’ve got to start with the tax code. And we’ve got to start with investments in how people are able to live the American dream, which is in serious, serious decline. Matter of fact, last time I checked the list of countries to live out the American dream, in other words, to be born at the bottom and come out at the top, we’re not even in the top 10 number. Number one place to live out the American dream right now is Denmark."
311,9,1,Buttigieg,candidate,11:53,"And as the, I think, the lone person on this stage who’s not a millionaire, let alone a billionaire, I believe that part of what needs to change is for the voices of the communities that haven’t felt heard on Wall Street or in Washington to actually be brought to Capitol Hill. It’s why I am building a politics designed around inclusion, designed around belonging, because the one thing that will definitely perpetuate the income inequality we’re living with right now is for Donald Trump to be reelected because we polarize this country with the wrong nominees."
312,9,1,,other,12:27,"Senator Sanders, it’s your policy."
313,9,1,Sanders,candidate,12:29,"That’s me, right?"
314,9,1,,other,12:30,It is your policy.
315,9,1,Sanders,candidate,12:31,"Thank you. It is my policy and I’m very proud of that policy. What we need to do to deal with this grotesque level of income and wealth inequality is make sure that those people who are working, you know what Mr. Bloomberg? It wasn’t you who made all that money. Maybe your workers played some role in that as well. And it is important that those workers are able to share the benefits also. When we have so many people go to work every day and they feel not good about their jobs, they feel like cogs in a machine. I want workers to be able to sit on corporate boards as well, so they can have some say of what happens to their lives."
316,9,1,,other,13:12,"Mayor Bloomberg, you own a large company. Would you support what Senator Sanders is proposing?"
317,9,1,,other,13:14,Absolutely not. I can’t think of a way that would make it easier for Donald Trump to get reelected than listening to this conversation. This is ridiculous. We’re not going to throw out capitalism. We tried that. Other countries tried that. It was called communism and it just didn’t work.
318,9,1,,other,13:33,"So let me make a proposal that will work, that has not only support from a majority of Democrats, but also from a majority of the independents and a majority of Republicans. And that is a two cent wealth tax on all fortunes above $50 million. You hit a billion, you’ve got to pay a few pennies more. This is a tax on the top 1/10th of 1% in America. And it permits us to start to restructure our economy. It means we can afford universal childcare for every baby in this country, age zero to five. It means we can have universal pre-K for every child in America. It means we can raise the wages of every childcare worker and preschool teacher and stop exploiting the black and brown women who do this work. It means we can put $800 billion into our public schools, quadruple funding for Title One schools."
319,9,1,,other,14:30,"And as a former special education teacher, we could fully fund IDEA so children with disabilities would get the full education they need. We can do college. We can put $50 billion dollars into our historically black colleges and universities. And we could cancel student loan debt for 43 million Americans. That’s something a majority of Americans support, a two cent wealth tax. It is a question of values. Do we want to invest in Mr. Bloomberg or do we want to invest in an entire generation?"
320,9,1,Todd,proctor,15:03,"Senator Sanders, my next question is for you. Senator Sanders, our latest NBC News, Wall Street Journal poll released yesterday. Two thirds of all voters said they were uncomfortable with a socialist candidate for President. What do you say to those voters, sir?"
321,9,1,Sanders,candidate,15:18,What was the result of that poll? Who was winning?
322,9,1,Todd,proctor,15:24,The questions to you.
323,9,1,Sanders,candidate,15:26,"Well, the question was that I was winning and I think by a fairly comfortable margin. You might mention that. But here is the point. Let’s talk about democratic socialism, not communism Mr. Bloomberg, that’s a cheap shot. Let’s talk about democratic. Let’s talk about what goes on in countries like Denmark, where Pete correctly pointed out, they have a much higher quality of life in many respects than we do. What are we talking about?"
324,9,1,Sanders,candidate,15:47,"We are living in many ways in a socialist society right now. Problem is, as Dr. Martin Luther King reminded us, we have socialism for the very rich, rugged individualism for the poor."
325,9,1,,other,16:01,Wait a second.
326,9,1,Sanders,candidate,16:02,"Let me finish. When Donald Trump gets $800 million in tax breaks and subsidies to build luxury condominiums, that’s socialism for the rich. Walmart, we have to subsidize Walmart’s workers who are on Medicaid and food stamps because the wealthiest family in America pays starvation wages, that’s socialism for the rich. I believe in democratic socialism for working people, not billionaires, health care for all, and educational opportunities for all."
327,9,1,Todd,proctor,16:40,"Senator, thank you. Mayor Bloomberg, would you like to- [crosstalk 00:16:41]."
328,9,1,Sanders,candidate,16:42,"Creating a government to works [crosstalk 00:16:44] for all, not just Mr. Bloomberg."
329,9,1,Todd,proctor,16:42,The question was about socialism.
330,9,1,,other,16:44,"What a wonderful country we have, the best known socialist in the country happens to be a millionaire with three houses. What’d I miss here?"
331,9,1,Sanders,candidate,16:51,"Well, you missed that I work in Washington, house one."
332,9,1,,other,16:53,That’s the first problem.
333,9,1,Sanders,candidate,16:55,"Live in Burlington, house two."
334,9,1,,other,16:57,That’s good.
335,9,1,Sanders,candidate,16:57,"And like thousands of other Vermonters, I do have a summer camp. Forgive me for that. Where is your home? Which tax?"
336,9,1,Sanders,candidate,17:03,"[inaudible 00:17:00] cap, forgive me for that. Where is your home? Which tax haven do you have your home?"
337,9,1,,other,17:05,"New York, New York city. Thank you very much. And I pay all my taxes and I’m happy to do it because I get something for it. And let me say, I thought that the senator next to me was half-right."
338,9,1,,other,17:15,[inaudible 00:17:17].
339,9,1,,other,17:16,"I agree. We should raise taxes on the … I disagree with the senator on the wealth tax, but I do agree with her that the rich aren’t paying their fair share. We should raise taxes on the rich. I did that as mayor in New York City. I raised taxes and if you take a look at my plans, the first thing I would do is try to convince Congress, because they’ve got to do it, we can’t just order it, to roll back the tax cuts that the Trump administration put in through Congress."
340,9,1,,other,17:49,"Joe, can we talk-"
341,9,1,Holt,proctor,17:49,"Vice President Biden, weigh in on this question of Americans’ feeling about socialist candidates."
342,9,1,Biden,candidate,17:54,"Well look, let me weigh in on, you know, for 36 years and as Vice President, I was listed as the poorest man in Congress. I made money when I wrote a book about my son and it surprised me how much it sold. First time I ever made any money, and here’s the deal. The fact is that we ought to start rewarding work, not just wealth. The idea that we have a tax rate for corporate America at 21% is ridiculous. It should be at 28%. that would raise almost $800 billion a year."
343,9,1,Biden,candidate,18:23,"The idea that we have companies not paying anything at all, they should have a minimum tax of 15%, that would raise another 740 billion a year. The idea that you’re able to have a capital gains tax that you pay at the rate of 20% if you are Mike Bloomberg or whomever, and has a whole lot of money and someone else is paying, your staffer is paying at 25%, is wrong. That would raise another $800 billion. We should be rewarding work, not just wealth. And the American people and the middle class is getting killed and the poor have no way up."
344,9,1,,other,19:06,Can we go back to one thing?
345,9,1,Holt,proctor,19:06,"All right, all right. Vice President Biden, thank you. Chuck?"
346,9,1,Todd,proctor,19:06,"Mayor Buttigieg, I want to get you in on this because in 2000, you wrote an award-winning essay. You praised Senator Sanders. You specifically praised him for embracing socialism. You have now since said that you are concerned about his policies, but I am curious about this. Are you out of touch with your own generation? Millennials, by a big chunk, embrace his version of democratic socialism. You do not. Are you out of touch with your generation?"
347,9,1,Buttigieg,candidate,19:31,"No. Look, it’s true that I was into Bernie before it was cool."
348,9,1,Sanders,candidate,19:37,Thank you.
349,9,1,Buttigieg,candidate,19:37,"He was a congressman at the time, and the qualities I admired then are qualities I still respect a great deal. I never said that I agree with every part of his policy views then or now, but I appreciate that at least he’s straightforward and honest about it, and he’s honest about the fact that taxes will go up on anybody making more than $29,000.00 to fund his health care plan. Although again, a little bit vague about how the rest of that gap-"
350,9,1,Sanders,candidate,20:02,"But you’re not being honest, the premiums would be eliminated."
351,9,1,Buttigieg,candidate,20:05,But you’re still raising those taxes and when you do it-
352,9,1,Sanders,candidate,20:08,"I’m saving people money because they don’t pay any premiums, out-of-pocket expenses, co-payments or deductibles. They’re going to be much better off."
353,9,1,Buttigieg,candidate,20:15,"But where’s the other $25 trillion supposed to come from? At a certain point, you got to do the math."
354,9,1,Sanders,candidate,20:23,"Well, we’ve got it all up there on the internet. It’s a payroll tax."
355,9,1,Buttigieg,candidate,20:27,"No, but even after the payroll tax because you still have a hole."
356,9,1,,other,20:30,Understanding-
357,9,1,Sanders,candidate,20:31,"Because we have a wealth tax. Elizabeth has a good one. Our is a little bit tougher on Mr. Bloomberg than hurts. We’re going to raise it in a progressive way, which deals with income and wealth inequality and make certain finally that healthcare in this country is a human right, not a privilege."
358,9,1,,other,20:47,Could I [crosstalk 00:20:49].
359,9,1,Todd,proctor,20:48,"45 seconds, Senator Warren, I’m just going to close it out here. You went out of your way to call yourself a capitalist."
360,9,1,,other,20:53,"Yes, because I am."
361,9,1,Todd,proctor,20:54,To separate yourself from him. Why?
362,9,1,,other,20:56,"Yes, because I am. Look, Democrats want to beat Donald Trump, but they are worried. They are worried about gambling on a narrow vision that doesn’t address the fears of millions of Americans across this country who see real problems and want real change. They are worried about gambling on a revolution that won’t bring along a majority of this country. Amy and Joe’s hearts are in the right place, but we can’t be so eager to be liked by Mitch McConnell that we forget how to fight the Republicans."
363,9,1,Klobuchar,candidate,21:35,Seriously? Elizabeth-
364,9,1,,other,21:35,Mayor Buttigieg has been taking money from big donors and changing his positions.
365,9,1,Buttigieg,candidate,21:42,That’s just not true.
366,9,1,,other,21:42,So it makes it unclear what it is he stands for other than his own advancement.
367,9,1,Todd,proctor,21:46,"Okay, Senator, thank you. Senator Klobuchar, go ahead you’ve got this."
368,9,1,Buttigieg,candidate,21:53,I’ll be very clear-
369,9,1,Todd,proctor,21:53,"Senator Klobuchar, go ahead. You’ve got the floor for 45, go."
370,9,1,Klobuchar,candidate,21:54,"Thank you. Number one. I have repeatedly said that we have to win big and the way we win big is winning states like Nevada, but also winning the Senate races in Arizona and in Colorado and beyond. And the reason we want to do that is to send Mitch McConnell packing. And I think when you look at my history, I am the one that has done that. I am the one that can lead this ticket and just because I am willing to talk about common ground, that’s where America is. It is not with Mitch McConnell who has 400 bills on his desk that should pass if we get rid of him."
371,9,1,,other,22:33,May I respond?
372,9,1,Klobuchar,candidate,22:33,It is because I am willing to work with people and find common ground.
373,9,1,Todd,proctor,22:38,Thank you Senator.
374,9,1,Holt,proctor,22:38,Let’s everybody-
375,9,1,Klobuchar,candidate,22:38,"That’s what we want in a president, Elisabeth."
376,9,1,Holt,proctor,22:41,Let’s catch our breath here.
377,9,1,Klobuchar,candidate,22:41,We don’t want someone that looks at just plans and different-
378,9,1,Holt,proctor,22:44,"Senator, thank you. We need to take another break here. We’ll return to The Paris Las Vegas in just a moment (silence)."
379,9,1,Holt,proctor,27:09,"Welcome back to Las Vegas and the Democratic Presidential Debate. To kick off our next round of questioning, here’s Hallie."
380,9,1,,other,27:11,"Mayor Buttigieg, to you. In 2018, Mayor Bloomberg was the biggest outside spender helping Democrats running for Congress. He’s also donated billions towards causes like climate change, gun safety, education. If his money wasn’t a problem then, why is it a problem now?"
381,9,1,Buttigieg,candidate,27:26,"Oh, I think he should absolutely be doing everything in his power to defeat Donald Trump. I just don’t think that has to result in him becoming the President of the United States. Look, our party has values. We were built around values like making sure we protect working people, but Mayor Bloomberg opposed raising the minimum wage. Our party has a tradition that includes excellent presidents like Barack Obama, who Mayor Bloomberg opposed."
382,9,1,Buttigieg,candidate,27:52,"At the end of the day, it’s not just about how much money you’ve got, it’s what you stand for. And we are living at a moment when Americans are so deeply frustrated with the way that both Wall Street and Washington seem to have overlooked our lives. The view from the porch of my one house in Indiana is that they can’t even see us sometimes. And if we’re going into the election of our lives against a president who rose to power by cynically exploited the frustration of ordinary Americans feeling like leaders weren’t speaking to them; then I think that turning to someone like Mayor Bloomberg who thinks he can buy this election is no better a way to succeed than turning to somebody like Senator Sanders who wants to burn the house down."
383,9,1,,other,28:44,Mr. Vice President.
384,9,1,Biden,candidate,28:45,"You know, if you [inaudible 00:28:47] the point of personal privilege used to say. It was said that I was in the pocket of Mitch McConnell. I’m the only person on this stage that’s beaten Mitch McConnell on four major, major cases. Let me finish. Let me finish. And Mitch McConnell. I’ve been the object of his affection and the President’s affection. The way he’s gone after me, this new Republican party, after me, after my son, after my family. I don’t need to be told I’m a friend of Mitch McConnell’s. Mitch McConnell has been the biggest pain in my neck in a long, long time and so that’s number one."
385,9,1,Biden,candidate,29:18,"Number two, we have to have somebody who understands what it’s like for ordinary people. Ordinary people come up. They have to understand, like my dad made that longest walk up a short flight of stairs, saying, “I don’t have a job honey. We have to move. You got to move in with grandpa.” How long it took to buy a house, how long it took to get back in the game again. They have to understand the needs of ordinary people and they are getting killed. No matter what people say about this economy, how good it is and the good part of the economy … It’s only 60 seconds, it’s not up yet, and the fact is that we’re in a situation where you have Mayor, excuse me, the President making clear that he doesn’t want any part of me being his opponent. He’s spending $125,000.00 this week to keep me from being an opponent. I wonder why?"
386,9,1,,other,30:07,"Thank you Mr. Vice President. Vanessa, to you."
387,9,1,,other,30:10,"Can I respond to the Vice President, please?"
388,9,1,,other,30:10,Thank you Hallie.
389,9,1,,other,30:11,He was identifying me specifically in that.
390,9,1,,other,30:13,45 seconds to you Senator Warren.
391,9,1,Biden,candidate,30:13,I was responding to an accusation.
392,9,1,,other,30:16,"And so no, the point is different. Here’s what happened. According to the New York Times, the last time that Mitch McConnell was on the ballot, the Vice President stood in the Oval Office and said, “I hope that Mitch gets re-elected so I can keep working with him.”"
393,9,1,Biden,candidate,30:32,That’s taken totally out of context.
394,9,1,,other,30:33,"Well, Mitch did get did cap re-elected. He did not have an epiphany. Instead, he blocked really everything that Barack Obama tried to pass."
395,9,1,Biden,candidate,30:43,Did you ever win anything?
396,9,1,,other,30:45,He stole a Supreme court seat-
397,9,1,Biden,candidate,30:47,Come on.
398,9,1,,other,30:48,"… From the Democrats, the Consumer Financial Protection Bureau?"
399,9,1,,other,30:52,Thank you Senator.
400,9,1,Biden,candidate,30:53,Yeah [inaudible 00:00:30:55].
401,9,1,,other,30:55,"Thank you Senator. Our next question goes to Senator Klobuchar. About 700,000 young people known as Dreamers or Soñadores, who were brought to this country as children, are currently protected from deportation because of a program that is now under the review by the Supreme Court. If the Court sides with the Trump administration, which is eager to end this protection, what exactly is your plan to protect the Dreamers permanently?"
402,9,1,Klobuchar,candidate,31:24,"To win. To beat Donald Trump. The best way to protect the Dreamers is to have a new President. There are the votes there to protect the Dreamers, and I have been working on this since I got to the United States Senate. In my first campaign, I actually had a bunch of ads run against me because I was standing up for immigrants. And when I think of Dreamers and I tried to explain it to my state, I found a 99-year-old Hispanic war veteran who was a Dreamer when he was brought over to this country. And back then, he just went to Canada for a night and came back and he was a permanent citizen because they needed him to serve in World War II. Now, not so easy. The Dreamers are our future. The Dreamers are so important in Nevada and the best way we can get this done is to beat Donald Trump, but it is to pass comprehensive immigration reform."
403,9,1,,other,32:18,Thank you.
404,9,1,Klobuchar,candidate,32:18,"Which creates a path to citizenship to so many hardworking people, who will bring down the deficit by $158 billion and will bring peace for these Dreamers."
405,9,1,,other,32:29,Thank you so much Senator Klobuchar.
406,9,1,Klobuchar,candidate,32:29,They know no other country but our own.
