statement_no,debate,night,speaker,speaker_type,timestamp,statement
0,9,1,Holt,proctor,00:00,"Good evening everyone. I’m Lester Holt. Welcome to Las Vegas. Everything is on the line tonight, with just three days before the critical Nevada caucuses. Here with me on the stage tonight, NBC News Political Director and moderator of Meet the Press, Chuck Todd. And NBC News Chief White House correspondent and MSNBC anchor, Hallie Jackson. Also joining us is Telemundo’s Senior Correspondent, Vanessa Hauc. And editor of the Nevada Independent Jon Ralston, who has covered Nevada politics for more than three decades. The rules are this tonight, candidates will get a minute 15 to answer each question and 45 seconds for followups. Now that the stage has narrowed to six candidates, we encourage each of you to directly engage with each other on the issues."
1,9,1,Holt,proctor,00:47,"So let’s get to our first question. Since the last time you all shared the stage, Senator Sanders, a self-described democratic socialist, has surged into the lead nationally in the democratic race. And there’s a new person on the stage tonight, Mayor Michael Bloomberg. A former Republican who spent millions of his own dollars to run in this race. What hasn’t changed? A majority of democratic voters still say their top priority is beating President Trump. Senator Sanders, the first question to you, Mayor Bloomberg is pitching himself as a centrist who says he’s best positioned to win in November. Why is your revolution a better bet?"
2,9,1,Sanders,candidate,01:25,"In order to beat Donald Trump, we’re going to need the largest voter turnout in the history of the United States. Mr. Bloomberg had policies in New York city of stop-and-frisk, which went after African American and Latino people in an outrageous way. That is not a way you’re going to grow voter turnout. What our movement is about is bringing working class people together, black and white and Latino, Native American, Asian American, around an agenda that works for all of us and not just the billionaire class. And that agenda says that maybe, just maybe, we should join the rest of the industrialized world, guarantee healthcare to all people as a human right, raise that minimum wage to a living wage of 15 bucks an hour. And have the guts to take on the fossil fuel industry, because their short term profits are not more important than the future of this planet and the need to combat climate change. Those are some of the reasons we have the strongest campaign to defeat Donald Trump."
3,9,1,,other,02:35,So I’d like-
4,9,1,Holt,proctor,02:36,"Mayor Bloomberg, can Senator Sanders beat President Trump and how do you want to respond to what else he said?"
5,9,1,,other,02:41,"I don’t think there’s any chance of the Senator beating President Trump. You don’t start out by saying, “I’ve got 160 million people, I’m going to take away the insurance plan that they love.” That’s just not a ways that you go and start building the coalition that the Sanders’ camp thinks that they can do. I don’t think there’s any chance whatsoever, and if he goes and is the candidate, we will have Donald Trump for another four years and we can’t stand that."
6,9,1,Holt,proctor,03:12,Senator Warren.
7,9,1,,other,03:14,"I’d like to talk about who we’re running against. A billionaire who calls women fat broads and horse faced lesbians. And no, I’m not talking about Donald Trump, I’m talking about mayor Bloomberg. Democrats are not going to win if we have a nominee who has a history of hiding his tax returns, of harassing women and of supporting racist policies like redlining and stop-and-frisk. Look, I’ll support whoever the democratic nominee is, but understand this, Democrats take a huge risk if we just substitute one arrogant billionaire for another. This country has worked for the rich for a long time and left everyone else in the dirt. It is time to have a president who will be on the side of working families and be willing to get out there and fight for them. That is why I am in this race and that is how I will beat Donald Trump."
8,9,1,Holt,proctor,04:14,"[crosstalk 00:04:14] Senator Klobuchar, what do you think the path is from this stage to the White House? What works?"
9,9,1,Klobuchar,candidate,04:21,"I think the path is a high voter turnout. I’m the one on this stage that had the highest voter turnout of any state in the country, when I led the tip ticket. As well as bringing in rural and suburban voters and I’ve done that as well. And I’m the only one with the receipts to have done that in Republican congressional districts over and over again. But I want to say this, I actually welcomed Mayor Bloomberg to the stage. I thought that he shouldn’t be hiding behind his TV ads, and so I was already for this big day. And then I looked at the memo from his campaign staff this morning and it said that he actually thought that three of us should get out of the way. That is what his campaign said, because we should pave the way for him to become the nominee."
10,9,1,Klobuchar,candidate,05:07,"I have been told as a woman, as someone that maybe no one thought was still going to be standing up on this stage, but I am because of pure grit and because of the people out there. I’ve been told many times to wait my turn and to step aside and I’m not going to do that now and I’m not going to do that because a campaign memo from Mayor Bloomberg said this morning that the only way that we get a nominee is if we step aside for him. I think we need something different than Donald Trump. I don’t think you look at Donald Trump and say, we need someone richer in the white house."
11,9,1,Holt,proctor,05:40,"Thank you. Mayor Bloomberg, there’s a lot for you to respond to there, so here’s your opportunity."
12,9,1,,other,05:45,"I think we have two questions to face tonight. One is, who can beat Donald Trump? And number two, who can do the job if they get into the White House? And I would argue that I am candidate that can do exactly both of those things. I’m a New Yorker. I know how to take on an arrogant con man like Donald Trump that comes from New York. I’m a mayor. I was a mayor. I know how to run a complicated city, the biggest, most diverse city in this country. I’m a manager. I knew what to do after 9-11 and brought the city back stronger than ever. And I’m a philanthropist who didn’t inherit his money, but made his money. And I’m spending that money to get rid of Donald Trump, the worst President we have ever had. And if I can get that done, it will be a great contribution to America and to my kids."
13,9,1,Holt,proctor,06:39,"Vice President Biden, I’ll let you weigh in there."
14,9,1,Biden,candidate,06:43,"In terms who can beat Donald Trump, NBC did a poll yesterday, says Joe Biden is best equipped to beat Donald Trump. That’s what your poll said. And it said that I can beat him in those toss up states too, those states we have to win. I’m ahead by eight points across the board. So in terms of being able to beat Donald Trump, I’m better positioned according to your poll than anybody else to beat Donald Trump, number one. Number two, the Mayor makes an interesting point. The mayor says that he has a great record, that he’s done these wonderful things."
15,9,1,Biden,candidate,07:14,"Well the fact of the matter is, he has not managed his city very, very well when he was there. He didn’t get a whole lot done. He has stop-and-frisk, throwing close to 5 million young black men up against a wall. And when we came along in our administration, President Obama and said, “We’re going to send in a mediator to stop it.” He said, “That’s unnecessary.” So we’re going to get a chance to talk about the mayor’s record, but in terms of who is best prepared to beat Donald Trump, look at your poll and what it says."
16,9,1,Holt,proctor,07:47,"Mayor Buttigieg, you’d like to weigh in."
17,9,1,Buttigieg,candidate,07:49,"Yes, we’ve got to wake up as a party. We could wake up two weeks from today, the day after super Tuesday, and the only candidates left standing will be Bernie Sanders and Mike Bloomberg, the two most polarizing figures on this stage. And most Americans don’t see where they fit, if they’ve got to choose between a socialist who thinks that capitalism is the root of all evil and a billionaire who thinks that money ought to be the root of all power. Let’s put forward somebody who actually lives and works in a middle-class neighborhood, in an industrial Midwestern city. Let’s put forward somebody who’s actually a Democrat. Look, we shouldn’t have to choose between one candidate who wants to burn this party down and another candidate who wants to buy this party out. We can do better."
18,9,1,Holt,proctor,08:46,"Senator Sanders, are you polarizing?"
19,9,1,Sanders,candidate,08:50,"If speaking to the needs and the pain of a long neglected working class is polarizing, I think you got the wrong word. What we are trying finally to do, is to give a voice to people who have to 45 years of work are not making a nickel more than they did 45 years ago. We are giving a voice to people who are saying we are sick of tired of billionaires like Mr. Bloomberg seeing huge expansions of their wealth, while a half a million people sleep out on the street tonight. And that’s what we are saying, Pete, is maybe it’s a time for the working class of this country to have a little bit of power in Washington rather than your billionaire campaign contributors."
20,9,1,Buttigieg,candidate,09:36,"All right. Look, first of all- [crosstalk 00:09:43] Look, my campaign is fueled by hundreds of thousands of contributors-"
21,9,1,Sanders,candidate,09:47,Including 46 billionaires.
22,9,1,Buttigieg,candidate,09:49,"Among the hundreds of thousands of contributors. And look, we’ve got to unite this country to deal with these issues. You’re not the only one who cares about the working class. Most Americans believe we need to empower workers. As a matter of fact, you’re the one who is at war with the Culinary Union right here in Las Vegas. We can’t-"
23,9,1,Sanders,candidate,10:10,We are more union support than you have ever dreamed of.
24,9,1,Buttigieg,candidate,10:14,We can-
25,9,1,Sanders,candidate,10:14,We have the support of unions all across this country.
26,9,1,Buttigieg,candidate,10:17,Yeah but the vision I’m putting forward has the support of the American people.
27,9,1,Sanders,candidate,10:20,Really.
28,9,1,Buttigieg,candidate,10:20,We can actually deliver healthcare without taking it away from anyone. We can actually empower workers and lift wages without further polarizing this country and we can build a movement without having legions of our supporters online and in person attacking democratic figures and union leaders alike-
29,9,1,,other,10:38,"Senator Warren, I have a question for you. On Sunday, on Meet the Press, Vice President Biden accused Senator Sanders supporters of bullying union leaders here with, “Vicious, malicious misogynistic things.” You said Democrats cannot build an inclusive party on a foundation of hate. Are Senator Sanders and his supporters making it harder for Democrats to unify in November?"
30,9,1,,other,11:00,"Look, I have said many times before, we are all responsible for our supporters. And we need to step up, that’s what leadership is all about. But the way we are going to lead this country and beat Donald Trump is going to be with a candidate who has rock solid values and who actually gets something done. When Mayor Bloomberg was busy blaming African Americans and Latinos for the housing crash of 2008, I was right here in Las Vegas, literally just a few blocks down the street holding hearings on the banks that were taking away homes from millions of families."
31,9,1,,other,11:39,"That’s when I met Mr. Estrada, one of your neighbors. He came in to testify and he said he thought he’d done everything right with Wells Fargo. But what had happened? They took away his house in a matter of weeks. This man stood there and cried while he talked about what it was like to tell his two little daughters that they might not be in their elementary schools, that they might be living out of their van. I spent the next years making sure that would never happen again. Wall Street fought us every inch of the way on a consumer agency. They lost and I won. We need a candidate with unshakeable values and a candidate who can actually get something done for working people. That’s why I’m in this race-"
32,9,1,,other,12:24,"Senator, thank you."
33,9,1,,other,12:24,And that’s how I’ll beat Donald Trump.
34,9,1,,other,12:25,Senator Sanders.
35,9,1,Sanders,candidate,12:27,"We have over 10.6 million people on Twitter and 99.9% of them are decent human beings, are working people, are people who believe in justice, compassion and love. And if there are a few people who make ugly remarks, who attack trade union leaders, I disowned those people, they are not part of our movement. But let me also say, what I hope my friends up here will agree with, is that if you look at the wild West of the internet, talk to some of the African American women on my campaign, talk to Senator Nina Turner, talk to others and find the vicious racist, sexist attacks that are coming their way as well. So I would hope that all of us understand that we should do everything we possibly can to end the viciousness and ugliness on the internet. Our campaign is about issues. It’s about fighting for the working families and the middle class. It is not about vicious attacks on other people."
36,9,1,Buttigieg,candidate,13:37,"Senator, when you say that you disown these attacks and you didn’t personally direct them, I believe you."
37,9,1,Sanders,candidate,13:42,Well thank you.
38,9,1,Buttigieg,candidate,13:43,"But at a certain point you got to ask yourself, why did this pattern arise? Why is it especially the case among your supporters that this happens?"
39,9,1,Sanders,candidate,13:50,I don’t think it is especially the case by the way-
40,9,1,Buttigieg,candidate,13:52,That’s just not true. People-
41,9,1,Sanders,candidate,13:55,"Pete if you want to talk to some of the women on my campaign, what you will see is the most ugly, sexist, racist attacks that are… I won’t even describe them here, they’re so disgusting. And let me say something else about this, not being too paranoid. All of us remember 2016 and what we remember his efforts by Russians and others to try to interfere in our election and divide us up. I’m not saying that’s happening, but it would not shock me. I saw some of those tweets regarding the Culinary Workers Union. I have a 30 year, 100% pro-union voting record. Do you think I would support or anybody supports me, would be attacking union leaders? It’s not thinkable."
42,9,1,Buttigieg,candidate,14:37,"But leadership is about what you draw out of people. It’s about how you inspire people to act. And right now we’re in this toxic political environment. Leadership isn’t just about policy. I think, at least in broad terms, we’re largely pulling in the same direction on policy. But leadership is also about how you motivate people to treat other people and I think you have to accept some responsibility and ask yourself what it is about your campaign and in particular that seems to be motivating this behavior more than others? Because in order to turn the page-"
43,9,1,Klobuchar,candidate,15:10,"I have an idea. I have an idea of how we can stop sexism on the internet. We could nominate a woman for candidate for President of the United States. I think that might go a long way, if we showed our stuff as a party. And the other thing I’m going to talk about is really what is at the core of this issue between Senator Sanders and the Culinary Union. And that is this, these are hardworking people. Housekeepers, like Elizabeth and I met with last night, who have healthcare plans that have been negotiated over time, sweat and blood. And that is the truth for so many Americans right now-"
44,9,1,,other,15:47,Senator thank you.
45,9,1,Klobuchar,candidate,15:48,There are 149 million Americans that would lose their current health insurance under Senator Sanders’ bill.
46,9,1,,other,15:55,Senator thank you.
47,9,1,Klobuchar,candidate,15:55,That’s what it says on page eight and I don’t think we should forget that.
48,9,1,,other,15:58,"On that note, I want to turn it over to my colleague Chuck Todd."
49,9,1,Todd,proctor,16:00,"Senator Sanders, I’m going to stay on this topic, on this issue with the Culinary Union. Obviously their leaders are warning their members about that your health care plan will take away their healthcare plan, take away private insurance completely. There are some Democrats who like you a lot, but worry that this plan, Medicare-for-all, is going to take away private insurance and that it goes too far. Are they right?"
50,9,1,Sanders,candidate,16:27,"No. Let me be very clear, two points. For a hundred years, from Teddy Roosevelt to Barack Obama, this country has been talking about the need to guarantee health care for people. And yet today, despite spending twice as much per capita, Chuck, twice as much as any other major country on earth, we got 87 million who are uninsured or under insured. We got over 60,000 people who die every year because they don’t get to a doctor on time. We’re getting ripped off outrageously by the greed and corruption of the pharmaceutical industry, which in some cases charges us 10 times more for the same drugs because of their price fixing. 500,000 people go bankrupt every year because they can’t afford medical bills. So let me be very clear, to my good friends in the Culinary Workers Union, a great union, I will never sign a bill that will reduce the health care benefits they have. We will only expand it, for them, for every union in America and for the working class of this country."
51,9,1,Todd,proctor,17:36,"Senator Warren, you were all in on Medicare-for-all and then you have since came up with a transition plan. Is it because of the impact on unions?"
52,9,1,,other,17:45,"So I want to be clear. I’ve been to the Culinary Unions’ healthcare facilities, they’re terrific. You don’t want to shut them down, you want to expand them. You want to see them all across Nevada and all across this country. But we need to get everybody’s healthcare plan out here. Mayor Buttigieg really has a slogan that was thought up by his consultants, to paper over a thin version of a plan that would leave millions of people unable to afford their healthcare. It’s not a plan, it’s a PowerPoint. And Amy’s plan is even less, it’s like a Post-it Note, insert plan here. Bernie has started very much, has a good start."
53,9,1,,other,18:31,"But instead of expanding and bringing in more people to help, instead his campaign relentlessly attacks everyone who asks a question or tries to fill in details about how to actually make this work. And then his own advisor’s say, “Eh, probably won’t happen anyway.” Look, healthcare is a crisis in this country. My approach to this is we need as much help for as many people as quickly as possible and bring in as many supporters as we can. And if we don’t get it all the first time, take the win and come back into the fight to ask for more."
54,9,1,Todd,proctor,19:12,"I promise guys, I’m going to get everybody in."
55,9,1,,other,19:13,People need our help on this.
56,9,1,Todd,proctor,19:14,"I got you. Mayor Buttigieg, I think she named checked you first. I’ll let you go first."
57,9,1,Sanders,candidate,19:19,She name checked me second.
58,9,1,Todd,proctor,19:23,"Yes. Well, okay. I think Amy’s second."
59,9,1,Buttigieg,candidate,19:25,"I’m more of a Microsoft Word guy. And if you look at my plan, I don’t know if there are any PowerPoints on it, but you can definitely find the document on peteforamerica.com. And you’ll see that it is a plan that solves the problem, makes sure there is no such thing as an uninsured American and does it without kicking anybody off the plan that they have. This idea that the union members don’t know what’s good for them is the exact kind of condescension and arrogance that makes people skeptical of the policies we’ve been putting forward."
60,9,1,Buttigieg,candidate,19:54,"Here we have a plan that the majority of Americans support. Do you realize how historic that is? That the American people are ready in a way, far beyond what was true even 10 years ago and what was available to President Obama at the time. There’s a powerful American majority ready to undertake the biggest, most progressive reform we’ve had in healthcare in 50 years, just so long as we don’t force it on anybody. What is wrong with that?"
61,9,1,,other,20:20,Can I respond to that? [crosstalk 00:20:20]
62,9,1,Todd,proctor,20:20,"Let me get Senator Klobuchar and then I’ll have you respond. All right, Senator Klobuchar."
63,9,1,Sanders,candidate,20:23,[inaudible 00:20:24].
64,9,1,Todd,proctor,20:25,"I think the Post-it Note came first, Senator. [crosstalk 00:20:28]"
65,9,1,Klobuchar,candidate,20:29,"I must say personal offense since post it notes were invented in my state. [crosstalk 00:00:20:38]. Okay. So my plan is a public option and according to all the studies out there, it would reduce premiums for 12 million people immediately. It would expand coverage for about that same number. It is a significant thing, it is what Barack Obama wanted to do from the very beginning. And the way I look at it since we’re in Vegas, when it comes to your plan, Elizabeth and Bernie’s on Medicare-for-all, you don’t put your money on a number that’s not even on the wheel."
66,9,1,Klobuchar,candidate,21:08,"And why is Medicare-for-all not on the wheel? Why is it not on the wheel? Because two thirds of the democratic Senators are not even on that bill, because a bunch of the new House members that got elected see the problems with blowing up the Affordable Care Act. They see it right in front of them. And the truth is that when you see some troubled waters, you don’t blow up a bridge, you build one. And so we need to improve the Affordable Care Act, not blow it up."
67,9,1,Todd,proctor,21:36,"All right, Senator Sanders."
68,9,1,,other,21:36,Can I just respond to these two?
69,9,1,Todd,proctor,21:36,I will. You name checked three of them. Let me get Senator Sanders in there.
70,9,1,Sanders,candidate,21:45,I am also a top-
71,9,1,Todd,proctor,21:45,You were.
72,9,1,,other,21:45,Okay.
73,9,1,Todd,proctor,21:46,"Go ahead, Senator Sanders. We’ll get you in Liz. We got a lot of people in here that got hit. [crosstalk 00:21:50]"
74,9,1,Sanders,candidate,21:49,"It’s my turn, yeah?"
75,9,1,Todd,proctor,21:51,Yes sir.
76,9,1,Sanders,candidate,21:52,"Okay. Somehow or another, Canada can provide universal health care to all their people at half the cost. UK can do it, France can do, Germany did. All…"
77,9,1,Sanders,candidate,22:03,"… half the cost. UK can do it. France can do it. Germany could. All of Europe can do it. Gee whiz. Somehow or another, we are the only major country on earth that can’t do it. Why is that? And I’ll tell you why. It’s because last year the healthcare industry made $100 billion in profits. Pharmaceutical industry, top six companies, $69 billion in profit. And those CEOs are contributing to Pete’s campaign and other campaigns. Up here-"
78,9,1,Todd,proctor,22:34,Let’s clear this up right now.
79,9,1,Sanders,candidate,22:34,"Maybe it is finally time that we said as a nation, “Enough is enough. The function of a rational healthcare system is not to make the pharmaceutical industry and the drug companies rich. It is to provide healthcare to all people as a human right, not a privilege.” No premiums."
80,9,1,Todd,proctor,22:54,"Mr. Vice President, we get it."
81,9,1,Sanders,candidate,22:56,No copayments. No deductibles.
82,9,1,Todd,proctor,22:58,"Go ahead. [crosstalk 00:22:59] Mr. Vice President, center one."
83,9,1,Biden,candidate,23:01,"I’m the only one in this stage that actually got anything done on healthcare. I’m the guy the president turned to and said, “Go get the votes for Obamacare.” And I notice what everybody’s talking about is the plan that I first introduced. That is to go and add to Obamacare, provide a public option, a Medicare like option it cost and increase the subsidies. It costs a lot of money. It cost $750 billion over 10 years, but I pay for it by making sure that Mike and other people pay at the same tax rate their secretary pays at. That’s how we get it paid, number one."
84,9,1,Biden,candidate,23:35,"Number two, you know from the moment we passed that signature legislation, Mike called it a disgrace. Number one. Number two, Trump decided to get rid of it. And number three, my friends here came up with another plan. But they don’t tell you when you ask Bernie how much it costs, the last time he said that, if he goes on your show, he said, “We’ll find out. We’ll find out how,” or something to that effect. It cost over 35 trillion bucks. Let’s get real."
85,9,1,Todd,proctor,24:02,"Senator Warren, you get the final word on this. We’re going to move to another question. Go ahead, Senator Warren."
86,9,1,Sanders,candidate,24:06,And your plan costs $50 trillion.
87,9,1,,other,24:07,So I actually-
88,9,1,,other,24:08,What am I? Chicken liver?
89,9,1,,other,24:09,"So I actually took a look at the plans that are posted. Mayor Buttigieg, there are four expenses that families pay, right? Premiums, deductibles, copays, and uncovered medical expenses. Mayor Buttigieg says he will put a cap only on the premiums."
90,9,1,Buttigieg,candidate,24:26,That’s not true.
